{
  "schema_version": 2,
  "run_version": 2,
  "experiment": "018_qwen_stage_diagnosis",
  "status": "gpu_run_complete",
  "task_id": "0934a4d8",
  "test_index": 0,
  "config": {
    "mode": "single_task_stage_diagnosis_v2",
    "run_version": 2,
    "task_id": "0934a4d8",
    "test_index": 0,
    "n_train_aug": 16,
    "train_geometries": 8,
    "epochs": 1,
    "optimizer_steps": 128,
    "learning_rate": 5e-05,
    "lora_seed": 42,
    "train_aug_seed": 1,
    "eval_seed": 2,
    "score_seed_offset": 0,
    "min_prob": 0.2,
    "dfs_window_seconds": 300,
    "condition_budget_seconds": 300,
    "baseline_v1_budget_seconds": 300,
    "baseline_v2_eval_augmentations": 2,
    "baseline_v2_decode_batch": 4,
    "baseline_v2_dfs_window_seconds": 540,
    "baseline_v2_budget_seconds": 1200,
    "phase_timeout_seconds": 10800,
    "lora": {
      "type": "RSLoRA",
      "rank": 256,
      "alpha": 32,
      "dropout": 0.0
    },
    "prefix_rows": [
      0,
      1,
      2,
      3,
      4,
      5,
      8
    ],
    "source_bbox_half_open": [
      0,
      3,
      14,
      23
    ],
    "report_filename": "stage_diagnosis_report_v2.json",
    "checkpoint": "sorokin/qwen3_4b_grids15_sft139",
    "model_source": "sorokin/qwen3_4b_grids15_sft139/Transformers/bfloat16/1",
    "kernel_source": "sorokin/pip-install-unsloth-flash-patch",
    "competition_source": "arc-prize-2026-arc-agi-2"
  },
  "label_lifecycle": {
    "valid": true,
    "events": [
      "ordinary_training_completed",
      "ordinary_generation_completed",
      "ordinary_worker_exited",
      "labels_opened",
      "oracle_payload_written",
      "oracle_training_completed",
      "oracle_payload_opened",
      "oracle_diagnostics_completed",
      "oracle_worker_exited"
    ],
    "ordinary_labels_available": false,
    "oracle_payload_opened_after_training": true,
    "post_label_optimizer_steps": 0
  },
  "training_runs": {
    "ordinary": {
      "steps": 128,
      "loss": 0.0022652014158666134,
      "seconds": 417.608,
      "training_examples": 128
    },
    "oracle_replay_before_payload_open": {
      "steps": 128,
      "loss": 0.0030210898257791996,
      "seconds": 411.237,
      "training_examples": 128
    }
  },
  "causal_questions": {
    "execution": {
      "transpose_probe": {
        "budget_seconds": 300,
        "dfs_window_seconds": 300,
        "prefix_token_count": 0,
        "score_scope": "generated_suffix_only",
        "score_comparability": "scores are comparable only within the same prefix length; cross-prefix raw or mean scores are not compared",
        "candidates": [
          {
            "grid": [
              [
                7,
                7,
                9
              ],
              [
                7,
                2,
                9
              ],
              [
                7,
                2,
                9
              ],
              [
                7,
                7,
                9
              ],
              [
                4,
                4,
                7
              ],
              [
                4,
                4,
                7
              ],
              [
                6,
                6,
                1
              ],
              [
                6,
                6,
                6
              ],
              [
                1,
                6,
                1
              ]
            ],
            "suffix_score": 0.9261856079101562,
            "generated_suffix_tokens": 36,
            "suffix_mean_score": 0.02572737799750434
          }
        ],
        "truth_present": true,
        "exact_candidate_count": 1,
        "metadata": {
          "causal_question": "execution",
          "oracle": true,
          "oracle_operation_hint": true,
          "fair_solver_condition": false,
          "ood": true
        }
      },
      "can_transpose_oracle_crop_with_hint": true
    },
    "localization": {
      "baseline": {
        "budget_seconds": 300,
        "dfs_window_seconds": 300,
        "prefix_token_count": 0,
        "score_scope": "generated_suffix_only",
        "score_comparability": "scores are comparable only within the same prefix length; cross-prefix raw or mean scores are not compared",
        "candidates": [
          {
            "grid": [
              [
                9,
                1,
                3
              ],
              [
                9,
                9,
                2
              ],
              [
                9,
                9,
                2
              ],
              [
                9,
                1,
                3
              ],
              [
                7,
                2,
                7
              ],
              [
                7,
                7,
                9
              ],
              [
                1,
                6,
                7
              ],
              [
                6,
                6,
                6
              ],
              [
                1,
                5,
                4
              ]
            ],
            "suffix_score": 0.450836181640625,
            "generated_suffix_tokens": 36,
            "suffix_mean_score": 0.012523227267795138
          },
          {
            "grid": [
              [
                9,
                1,
                3
              ],
              [
                9,
                9,
                2
              ],
              [
                9,
                9,
                2
              ],
              [
                9,
                1,
                3
              ],
              [
                7,
                2,
                7
              ],
              [
                7,
                7,
                9
              ],
              [
                1,
                6,
                7
              ],
              [
                6,
                6,
                6
              ],
              [
                1,
                6,
                1
              ]
            ],
            "suffix_score": 1.4498977661132812,
            "generated_suffix_tokens": 36,
            "suffix_mean_score": 0.04027493794759115
          }
        ],
        "truth_present": false,
        "exact_candidate_count": 0
      },
      "baseline_exp015_comparable": {
        "contract": "experiment_015_inference_augmentation",
        "eval_augmentations": 2,
        "geometries": 8,
        "expected_views": 16,
        "decoded_views": 16,
        "decode_batch": 4,
        "budget_seconds": 1200,
        "dfs_window_seconds": 540,
        "min_prob": 0.2,
        "timed_out": false,
        "candidates": [
          {
            "grid": [
              [
                9,
                1,
                3
              ],
              [
                9,
                9,
                2
              ],
              [
                9,
                9,
                2
              ],
              [
                9,
                1,
                3
              ],
              [
                7,
                2,
                7
              ],
              [
                7,
                7,
                9
              ],
              [
                1,
                6,
                7
              ],
              [
                6,
                6,
                6
              ],
              [
                1,
                6,
                1
              ]
            ],
            "provenance": [
              {
                "view": "0934a4d8_0.permute9302675184.ex1302",
                "view_score": 0.34983062744140625,
                "generated_tokens": 36
              }
            ]
          },
          {
            "grid": [
              [
                3,
                1,
                9
              ],
              [
                2,
                9,
                9
              ],
              [
                2,
                9,
                9
              ],
              [
                3,
                1,
                9
              ],
              [
                4,
                4,
                7
              ],
              [
                4,
                4,
                7
              ],
              [
                6,
                6,
                1
              ],
              [
                6,
                6,
                6
              ],
              [
                1,
                6,
                1
              ]
            ],
            "provenance": [
              {
                "view": "0934a4d8_0.rot90.rot90.permute5386701942.ex0213",
                "view_score": 0.36399078369140625,
                "generated_tokens": 36
              },
              {
                "view": "0934a4d8_0.rot90.rot90.permute8579032416.ex3201",
                "view_score": 0.42650604248046875,
                "generated_tokens": 36
              },
              {
                "view": "0934a4d8_0.rot90.permute4281673590.ex0213",
                "view_score": 0.16983795166015625,
                "generated_tokens": 30
              },
              {
                "view": "0934a4d8_0.transpose.rot90.rot90.permute0986123745.ex2103",
                "view_score": 0.23091888427734375,
                "generated_tokens": 30
              }
            ]
          },
          {
            "grid": [
              [
                9,
                1,
                3
              ],
              [
                9,
                9,
                2
              ],
              [
                9,
                9,
                2
              ],
              [
                9,
                1,
                3
              ],